{"schema_version":"semantic-rubric-result/1.0.0","eval_id":"rrh-final-lock-eval-analyst-skeptic-strong-conflict-20260909","grader":{"agent":"dev_eval","model":"gpt-5.6-terra","prompt_hash":"937f77555a8f4f251de353019cc52b3e7e58fc532a16b2013f0f62a250edd4de","rubric_hash":"8c4e0b1233b26f8799e9e083070945b936781b528a56f6dd2da3cc5cf409131f","input_hash":"1f64bb326436ba6ad378ecf2ab1adc0f4d3ecfc322dc2ea7073bbd63722ec965"},"dimensions":{"no_trade_reasoning":{"status":"PASS","grade":3,"evidence_refs":["ev-conflict-revenue-a","ev-conflict-revenue-b","ev-conflict-margin","ev-conflict-price"],"rationale":"CIO 与 decision.json 均将同一报告期的未解决收入冲突及补充经营和估值数据缺口列为 NO_TRADE 原因，并给出取得统一可追溯收入口径和补充同口径证据后的重评条件；与 Evidence Gate 的冲突记录和 SAFE_NO_TRADE 一致。"},"analyst_thesis_grounding":{"status":"PASS","grade":3,"evidence_refs":["claim-margin-fact","claim-price-fact","claim-revenue-conflict-fact","claim-thesis-limited","ev-conflict-margin","ev-conflict-price","ev-conflict-revenue-a","ev-conflict-revenue-b"],"rationale":"Analyst 将利润率、价格和两项收入观察分别标注为 FACT 并引用允许证据；其 INTERPRETATION 明确受同期间收入冲突和数据缺口限制，未将未证实的收入规模、增长或估值判断表述为事实。"},"skeptic_counter_evidence":{"status":"PASS","grade":3,"evidence_refs":["revenue-definition-or-restatement-conflict","profitability-context-gap","price-is-not-valuation-evidence","ev-conflict-margin","ev-conflict-price","ev-conflict-revenue-a","ev-conflict-revenue-b"],"rationale":"Skeptic 以 INDEPENDENT_FIRST_PASS 提出具体的收入口径、利润率可比性和价格语境挑战，逐项引用授权证据，列明可证伪的替代解释、所需解决证据和失效条件。"},"cio_conflict_handling":{"status":"PASS","grade":3,"evidence_refs":["ev-conflict-revenue-a","ev-conflict-revenue-b","ev-conflict-margin","ev-conflict-price"],"rationale":"CIO 明确记录 Specialist 对收入冲突和证据边界的共识，保留未解决冲突、未决问题及其对收入、盈利和估值推导的影响，并在 decision.json 中保持与 Risk APPROVED 和 SAFE_NO_TRADE 一致的结论。"},"confidence_calibration":{"status":"PASS","grade":3,"evidence_refs":["ev-conflict-margin","ev-conflict-price","ev-conflict-revenue-a","ev-conflict-revenue-b"],"rationale":"Analyst、Skeptic 和 CIO 的置信度理由均将判断范围限定为已验证冲突或有限事实，并随未解决收入冲突、口径不明及经营和估值数据缺口保持审慎；未以固定数值或市场结果作为正确性依据。"}},"output_hash":"c7375c09d11da69d2b3cb1f78ec5e2b6bd0d84def6c891a034f37ac06848d08b"}
